<?xml version="1.0"?>
<!DOCTYPE notes SYSTEM "notas.dtd">
<diario>
<nombre></nombre>
<telefono></telefono>
<notes>
    <note>
        <to>Tove</to>
        <from>Jani</from>
        <heading>Reminder</heading>
        <body>Don't forget me this weekend</body>
    </note>
    <note>
        <to>Tove</to>
        <from>Jani</from>
        <heading>Reminder</heading>
        <body>Don't forget me this weekend</body>
    </note>
</notes>
</diario>